No.     Time           Source                Destination           Protocol Length Info
  18876 59.746718544   192.168.56.51         192.168.56.21         TCP      76     47233 → 6789 [SYN] Seq=0 Win=29200 Len=0 MSS=1460 SACK_PERM=1 TSval=1026650 TSecr=0 WS=32

Frame 18876: 76 bytes on wire (608 bits), 76 bytes captured (608 bits) on interface 0
Linux cooked capture
Internet Protocol Version 4, Src: 192.168.56.51, Dst: 192.168.56.21
Transmission Control Protocol, Src Port: 47233, Dst Port: 6789, Seq: 0, Len: 0
_______________________________________________________
							
	The Client requests connection to the WebServer	
_______________________________________________________

No.     Time           Source                Destination           Protocol Length Info
  18877 59.746912300   192.168.56.21         192.168.56.51         TCP      76     6789 → 47233 [SYN, ACK] Seq=0 Ack=1 Win=28960 Len=0 MSS=1460 SACK_PERM=1 TSval=1033311 TSecr=1026650 WS=32

Frame 18877: 76 bytes on wire (608 bits), 76 bytes captured (608 bits) on interface 0
Linux cooked capture
Internet Protocol Version 4, Src: 192.168.56.21, Dst: 192.168.56.51
Transmission Control Protocol, Src Port: 6789, Dst Port: 47233, Seq: 0, Ack: 1, Len: 0
_______________________________________________________________________________________
											
	The WebServer acknowledgments the Client's connection request and accepts it	
_______________________________________________________________________________________

No.     Time           Source                Destination           Protocol Length Info
  18878 59.746927033   192.168.56.51         192.168.56.21         TCP      68     47233 → 6789 [ACK] Seq=1 Ack=1 Win=29216 Len=0 TSval=1026651 TSecr=1033311

Frame 18878: 68 bytes on wire (544 bits), 68 bytes captured (544 bits) on interface 0
Linux cooked capture
Internet Protocol Version 4, Src: 192.168.56.51, Dst: 192.168.56.21
Transmission Control Protocol, Src Port: 47233, Dst Port: 6789, Seq: 1, Ack: 1, Len: 0
_______________________________________________________________________________
									
	The Client acknowledgments that the WebServer accepts the connection	
_______________________________________________________________________________

     Time           Source                Destination           Protocol Length Info
  18879 59.746983386   192.168.56.51         192.168.56.21         TCP      92     47233 → 6789 [PSH, ACK] Seq=1 Ack=1 Win=29216 Len=24 TSval=1026651 TSecr=1033311

Frame 18879: 92 bytes on wire (736 bits), 92 bytes captured (736 bits) on interface 0
Linux cooked capture
Internet Protocol Version 4, Src: 192.168.56.51, Dst: 192.168.56.21
Transmission Control Protocol, Src Port: 47233, Dst Port: 6789, Seq: 1, Ack: 1, Len: 24
Data (24 bytes)

0000  47 45 54 20 2f 69 6e 64 65 78 2e 68 74 6d 6c 20   GET /index.html 
0010  48 54 54 50 2f 31 2e 31                           HTTP/1.1
_______________________________________________________________
								
	The Client sends the HTTP Request to the WebServer	
_______________________________________________________________

No.     Time           Source                Destination           Protocol Length Info
  18880 59.747269067   192.168.56.21         192.168.56.51         TCP      68     6789 → 47233 [ACK] Seq=1 Ack=25 Win=28960 Len=0 TSval=1033311 TSecr=1026651

Frame 18880: 68 bytes on wire (544 bits), 68 bytes captured (544 bits) on interface 0
Linux cooked capture
Internet Protocol Version 4, Src: 192.168.56.21, Dst: 192.168.56.51
Transmission Control Protocol, Src Port: 6789, Dst Port: 47233, Seq: 1, Ack: 25, Len: 0
_______________________________________________________________________________________________________________________
														
	The WebServer acknowledgments of the Client's HTTP Request by sending the Delivery Receipt to the Client	
_______________________________________________________________________________________________________________________

No.     Time           Source                Destination           Protocol Length Info
  18881 59.747276867   192.168.56.21         192.168.56.51         TCP      85     6789 → 47233 [PSH, ACK] Seq=1 Ack=25 Win=28960 Len=17 TSval=1033311 TSecr=1026651 [TCP segment of a reassembled PDU]

Frame 18881: 85 bytes on wire (680 bits), 85 bytes captured (680 bits) on interface 0
Linux cooked capture
Internet Protocol Version 4, Src: 192.168.56.21, Dst: 192.168.56.51
Transmission Control Protocol, Src Port: 6789, Dst Port: 47233, Seq: 1, Ack: 25, Len: 17
_______________________________________________________
						
	The WebServer sends a HTTP Header to the Client	
_______________________________________________________

No.     Time           Source                Destination           Protocol Length Info
  18882 59.747313980   192.168.56.51         192.168.56.21         TCP      68     47233 → 6789 [ACK] Seq=25 Ack=18 Win=29216 Len=0 TSval=1026651 TSecr=1033311

Frame 18882: 68 bytes on wire (544 bits), 68 bytes captured (544 bits) on interface 0
Linux cooked capture
Internet Protocol Version 4, Src: 192.168.56.51, Dst: 192.168.56.21
Transmission Control Protocol, Src Port: 47233, Dst Port: 6789, Seq: 25, Ack: 18, Len: 0
_______________________________________________________________________________________________________
												
	The Client acknowledgments of HTTP Header by sending the Delivery Receipt to the WebServer	
_______________________________________________________________________________________________________

No.     Time           Source                Destination           Protocol Length Info
  18883 59.748223823   192.168.56.21         192.168.56.51         TCP      69     6789 → 47233 [PSH, ACK] Seq=18 Ack=25 Win=28960 Len=1 TSval=1033312 TSecr=1026651 [TCP segment of a reassembled PDU]

Frame 18883: 69 bytes on wire (552 bits), 69 bytes captured (552 bits) on interface 0
Linux cooked capture
Internet Protocol Version 4, Src: 192.168.56.21, Dst: 192.168.56.51
Transmission Control Protocol, Src Port: 6789, Dst Port: 47233, Seq: 18, Ack: 25, Len: 1
_______________________________________________________________________
									
	The WebServer sends a HTTP Response excerpt to the Client	
_______________________________________________________________________

No.     Time           Source                Destination           Protocol Length Info
  18884 59.748261745   192.168.56.51         192.168.56.21         TCP      68     47233 → 6789 [ACK] Seq=25 Ack=19 Win=29216 Len=0 TSval=1026651 TSecr=1033312

Frame 18884: 68 bytes on wire (544 bits), 68 bytes captured (544 bits) on interface 0
Linux cooked capture
Internet Protocol Version 4, Src: 192.168.56.51, Dst: 192.168.56.21
Transmission Control Protocol, Src Port: 47233, Dst Port: 6789, Seq: 25, Ack: 19, Len: 0
_______________________________________________________________________________________________________________
														
	The Client acknowledgments of HTTP Response excerpt by sending the Delivery Receipt to the WebServer	
_______________________________________________________________________________________________________________

No.     Time           Source                Destination           Protocol Length Info
  18885 59.748389866   192.168.56.21         192.168.56.51         HTTP     146    HTTP/1.1 200 OK 

Frame 18885: 146 bytes on wire (1168 bits), 146 bytes captured (1168 bits) on interface 0
Linux cooked capture
Internet Protocol Version 4, Src: 192.168.56.21, Dst: 192.168.56.51
Transmission Control Protocol, Src Port: 6789, Dst Port: 47233, Seq: 19, Ack: 25, Len: 78
[3 Reassembled TCP Segments (96 bytes): #18881(17), #18883(1), #18885(78)]
Hypertext Transfer Protocol
_______________________________________________________________________
									
	The WebServer sends a HTTP Response excerpt to the Client	
_______________________________________________________________________

No.     Time           Source                Destination           Protocol Length Info
  18886 59.748424069   192.168.56.51         192.168.56.21         TCP      68     47233 → 6789 [ACK] Seq=25 Ack=97 Win=29216 Len=0 TSval=1026651 TSecr=1033312
Trecho de resposta HTTP
Frame 18886: 68 bytes on wire (544 bits), 68 bytes captured (544 bits) on interface 0
Linux cooked capture
Internet Protocol Version 4, Src: 192.168.56.51, Dst: 192.168.56.21
Transmission Control Protocol, Src Port: 47233, Dst Port: 6789, Seq: 25, Ack: 97, Len: 0
_______________________________________________________________________________________________________________
														
	The Client acknowledgments of HTTP Response excerpt by sending the Delivery Receipt to the WebServer	
_______________________________________________________________________________________________________________

No.     Time           Source                Destination           Protocol Length Info
  18887 59.748560393   192.168.56.21         192.168.56.51         TCP      144    6789 → 47233 [PSH, ACK] Seq=97 Ack=25 Win=28960 Len=76 TSval=1033312 TSecr=1026651

Frame 18887: 144 bytes on wire (1152 bits), 144 bytes captured (1152 bits) on interface 0Trecho de respostTrecho de resposta HTTPa HTTP
Linux cooked capture
Internet Protocol Version 4, Src: 192.168.56.21, Dst: 192.168.56.51
Transmission Control Protocol, Src Port: 6789, Dst Port: 47233, Seq: 97, Ack: 25, Len: 76
_______________________________________________________________________
									
	The WebServer sends a HTTP Response excerpt to the Client	
_______________________________________________________________________

No.     Time           Source                Destination           Protocol Length Info
  18888 59.748594524   192.168.56.51         192.168.56.21         TCP      68     47233 → 6789 [ACK] Seq=25 Ack=173 Win=29216 Len=0 TSval=1026651 TSecr=1033312

Frame 18888: 68 bytes on wire (544 bits), 68 bytes captured (544 bits) on interface 0
Linux cooked capture
Internet Protocol Version 4, Src: 192.168.56.51, Dst: 192.168.56.21
Transmission Control Protocol, Src Port: 47233, Dst Port: 6789, Seq: 25, Ack: 173, Len: 0
_______________________________________________________________________________________________________________
														
	The Client acknowledgments of HTTP Response excerpt by sending the Delivery Receipt to the WebServer	
_______________________________________________________________________________________________________________

No.     Time           Source                Destination           Protocol Length Info
  18889 59.748743770   192.168.56.21         192.168.56.51         TCP      148    6789 → 47233 [PSH, ACK] Seq=173 Ack=25 Win=28960 Len=80 TSval=1033312 TSecr=1026651

Frame 18889: 148 bytes on wire (1184 bits), 148 bytes captured (1184 bits) on interface 0
Linux cooked capture
Internet Protocol Version 4, Src: 192.168.56.21, Dst: 192.168.56.51
Transmission Control Protocol, Src Port: 6789, Dst Port: 47233, Seq: 173, Ack: 25, Len: 80
_______________________________________________________________________
									
	The WebServer sends a HTTP Response excerpt to the Client	
_______________________________________________________________________

No.     Time           Source                Destination           Protocol Length Info
  18890 59.748778227   192.168.56.51         192.168.56.21         TCP      68     47233 → 6789 [ACK] Seq=25 Ack=253 Win=29216 Len=0 TSval=1026651 TSecr=1033312

Frame 18890: 68 bytes on wire (544 bits), 68 bytes captured (544 bits) on interface 0
Linux cooked capture
Internet Protocol Version 4, Src: 192.168.56.51, Dst: 192.168.56.21
Transmission Control Protocol, Src Port: 47233, Dst Port: 6789, Seq: 25, Ack: 253, Len: 0
_______________________________________________________________________________________________________________
														
	The Client acknowledgments of HTTP Response excerpt by sending the Delivery Receipt to the WebServer	
_______________________________________________________________________________________________________________

No.     Time           Source                Destination           Protocol Length Info
  18891 59.748900320   192.168.56.21         192.168.56.51         TCP      135    6789 → 47233 [PSH, ACK] Seq=253 Ack=25 Win=28960 Len=67 TSval=1033312 TSecr=1026651

Frame 18891: 135 bytes on wire (1080 bits), 135 bytes captured (1080 bits) on interface 0
Linux cooked capture
Internet Protocol Version 4, Src: 192.168.56.21, Dst: 192.168.56.51
Transmission Control Protocol, Src Port: 6789, Dst Port: 47233, Seq: 253, Ack: 25, Len: 67
_______________________________________________________________________
									
	The WebServer sends a HTTP Response excerpt to the Client	
_______________________________________________________________________

No.     Time           Source                Destination           Protocol Length Info
  18892 59.748934128   192.168.56.51         192.168.56.21         TCP      68     47233 → 6789 [ACK] Seq=25 Ack=320 Win=29216 Len=0 TSval=1026651 TSecr=1033312

Frame 18892: 68 bytes on wire (544 bits), 68 bytes captured (544 bits) on interface 0
Linux cooked capture
Internet Protocol Version 4, Src: 192.168.56.51, Dst: 192.168.56.21
Transmission Control Protocol, Src Port: 47233, Dst Port: 6789, Seq: 25, Ack: 320, Len: 0
_______________________________________________________________________________________________________________
														
	The Client acknowledgments of HTTP Response excerpt by sending the Delivery Receipt to the WebServer	
_______________________________________________________________________________________________________________

No.     Time           Source                Destination           Protocol Length Info
  18893 59.749068424   192.168.56.21         192.168.56.51         TCP      142    6789 → 47233 [PSH, ACK] Seq=320 Ack=25 Win=28960 Len=74 TSval=1033312 TSecr=1026651

Frame 18893: 142 bytes on wire (1136 bits), 142 bytes captured (1136 bits) on interface 0
Linux cooked capture
Internet Protocol Version 4, Src: 192.168.56.21, Dst: 192.168.56.51
Transmission Control Protocol, Src Port: 6789, Dst Port: 47233, Seq: 320, Ack: 25, Len: 74
_______________________________________________________________________
									
	The WebServer sends a HTTP Response excerpt to the Client	
_______________________________________________________________________

No.     Time           Source                Destination           Protocol Length Info
  18894 59.749102673   192.168.56.51         192.168.56.21         TCP      68     47233 → 6789 [ACK] Seq=25 Ack=394 Win=29216 Len=0 TSval=1026651 TSecr=1033312

Frame 18894: 68 bytes on wire (544 bits), 68 bytes captured (544 bits) on interface 0
Linux cooked capture
Internet Protocol Version 4, Src: 192.168.56.51, Dst: 192.168.56.21
Transmission Control Protocol, Src Port: 47233, Dst Port: 6789, Seq: 25, Ack: 394, Len: 0
_______________________________________________________________________________________________________________
														
	The Client acknowledgments of HTTP Response excerpt by sending the Delivery Receipt to the WebServer	
_______________________________________________________________________________________________________________

No.     Time           Source                Destination           Protocol Length Info
  18895 59.749236237   192.168.56.21         192.168.56.51         TCP      114    6789 → 47233 [PSH, ACK] Seq=394 Ack=25 Win=28960 Len=46 TSval=1033312 TSecr=1026651

Frame 18895: 114 bytes on wire (912 bits), 114 bytes captured (912 bits) on interface 0
Linux cooked capture
Internet Protocol Version 4, Src: 192.168.56.21, Dst: 192.168.56.51
Transmission Control Protocol, Src Port: 6789, Dst Port: 47233, Seq: 394, Ack: 25, Len: 46
_______________________________________________________________________
									
	The WebServer sends a HTTP Response excerpt to the Client	
_______________________________________________________________________

No.     Time           Source                Destination           Protocol Length Info
  18896 59.749271998   192.168.56.51         192.168.56.21         TCP      68     47233 → 6789 [ACK] Seq=25 Ack=440 Win=29216 Len=0 TSval=1026651 TSecr=1033312

Frame 18896: 68 bytes on wire (544 bits), 68 bytes captured (544 bits) on interface 0
Linux cooked capture
Internet Protocol Version 4, Src: 192.168.56.51, Dst: 192.168.56.21
Transmission Control Protocol, Src Port: 47233, Dst Port: 6789, Seq: 25, Ack: 440, Len: 0
_______________________________________________________________________________________________________________
														
	The Client acknowledgments of HTTP Response excerpt by sending the Delivery Receipt to the WebServer	
_______________________________________________________________________________________________________________

No.     Time           Source                Destination           Protocol Length Info
  18897 59.749308588   192.168.56.21         192.168.56.51         TCP      68     6789 → 47233 [FIN, ACK] Seq=440 Ack=25 Win=28960 Len=0 TSval=1033312 TSecr=1026651

Frame 18897: 68 bytes on wire (544 bits), 68 bytes captured (544 bits) on interface 0
Linux cooked capture
Internet Protocol Version 4, Src: 192.168.56.21, Dst: 192.168.56.51
Transmission Control Protocol, Src Port: 6789, Dst Port: 47233, Seq: 440, Ack: 25, Len: 0
_______________________________________________________________________________
										
	The WebServer acknowledgments and closes the Client's connection	
_______________________________________________________________________________

No.     Time           Source                Destination           Protocol Length Info
  18994 59.754549820   192.168.56.51         192.168.56.21         TCP      68     47233 → 6789 [FIN, ACK] Seq=25 Ack=441 Win=29216 Len=0 TSval=1026652 TSecr=1033312

Frame 18994: 68 bytes on wire (544 bits), 68 bytes captured (544 bits) on interface 0
Linux cooked capture
Internet Protocol Version 4, Src: 192.168.56.51, Dst: 192.168.56.21
Transmission Control Protocol, Src Port: 47233, Dst Port: 6789, Seq: 25, Ack: 441, Len: 0
_______________________________________________________________________________
										
	The Client acknowledgments and closes the WebServer's connection	
_______________________________________________________________________________

No.     Time           Source                Destination           Protocol Length Info
  18995 59.754705270   192.168.56.21         192.168.56.51         TCP      68     6789 → 47233 [ACK] Seq=441 Ack=26 Win=28960 Len=0 TSval=1033313 TSecr=1026652

Frame 18995: 68 bytes on wire (544 bits), 68 bytes captured (544 bits) on interface 0
Linux cooked capture
Internet Protocol Version 4, Src: 192.168.56.21, Dst: 192.168.56.51
Transmission Control Protocol, Src Port: 6789, Dst Port: 47233, Seq: 441, Ack: 26, Len: 0
 _______________________________________________________________________________________
											
	The WebServer acknowledgments the connection termination with the Client	
_______________________________________________________________________________________

