No.     Time           Source                Destination           Protocol Length Info
  13663 13.094106071   192.168.56.51         192.168.56.21         TCP      76     47221 → 6789 [SYN] Seq=0 Win=29200 Len=0 MSS=1460 SACK_PERM=1 TSval=949800 TSecr=0 WS=32

Frame 13663: 76 bytes on wire (608 bits), 76 bytes captured (608 bits) on interface 0
Linux cooked capture
Internet Protocol Version 4, Src: 192.168.56.51, Dst: 192.168.56.21
Transmission Control Protocol, Src Port: 47221, Dst Port: 6789, Seq: 0, Len: 0
_______________________________________________________
							
	The Client requests connection to the WebServer	
_______________________________________________________

No.     Time           Source                Destination           Protocol Length Info
  13664 13.094743716   192.168.56.21         192.168.56.51         TCP      76     6789 → 47221 [SYN, ACK] Seq=0 Ack=1 Win=28960 Len=0 MSS=1460 SACK_PERM=1 TSval=956460 TSecr=949800 WS=32

Frame 13664: 76 bytes on wire (608 bits), 76 bytes captured (608 bits) on interface 0
Linux cooked capture
Internet Protocol Version 4, Src: 192.168.56.21, Dst: 192.168.56.51
Transmission Control Protocol, Src Port: 6789, Dst Port: 47221, Seq: 0, Ack: 1, Len: 0
_______________________________________________________________________________________
											
	The WebServer acknowledgments the Client's connection request and accepts it	
_______________________________________________________________________________________

No.     Time           Source                Destination           Protocol Length Info
  13665 13.094781844   192.168.56.51         192.168.56.21         TCP      68     47221 → 6789 [ACK] Seq=1 Ack=1 Win=29216 Len=0 TSval=949800 TSecr=956460

Frame 13665: 68 bytes on wire (544 bits), 68 bytes captured (544 bits) on interface 0
Linux cooked capture
Internet Protocol Version 4, Src: 192.168.56.51, Dst: 192.168.56.21
Transmission Control Protocol, Src Port: 47221, Dst Port: 6789, Seq: 1, Ack: 1, Len: 0
_______________________________________________________________________________
										
	The Client acknowledgments that the WebServer accepts the connection	
_______________________________________________________________________________

No.     Time           Source                Destination           Protocol Length Info
  15135 21.946594880   192.168.56.51         192.168.56.21         TCP      94     47221 → 6789 [PSH, ACK] Seq=1 Ack=1 Win=29216 Len=26 TSval=952013 TSecr=956460 [TCP segment of a reassembled PDU]

Frame 15135: 94 bytes on wire (752 bits), 94 bytes captured (752 bits) on interface 0
Linux cooked capture
Internet Protocol Version 4, Src: 192.168.56.51, Dst: 192.168.56.21
Transmission Control Protocol, Src Port: 47221, Dst Port: 6789, Seq: 1, Ack: 1, Len: 26
_______________________________________________________________
								
	The Client sends the HTTP Request to the WebServer	
_______________________________________________________________

No.     Time           Source                Destination           Protocol Length Info
  15136 21.947387023   192.168.56.21         192.168.56.51         TCP      68     6789 → 47221 [ACK] Seq=1 Ack=27 Win=28960 Len=0 TSval=958673 TSecr=952013

Frame 15136: 68 bytes on wire (544 bits), 68 bytes captured (544 bits) on interface 0
Linux cooked capture
Internet Protocol Version 4, Src: 192.168.56.21, Dst: 192.168.56.51
Transmission Control Protocol, Src Port: 6789, Dst Port: 47221, Seq: 1, Ack: 27, Len: 0
_______________________________________________________________________________________________________________________
															
	The WebServer acknowledgments of the Client's HTTP Request by sending the Delivery Receipt to the Client	
_______________________________________________________________________________________________________________________

No.     Time           Source                Destination           Protocol Length Info
  15137 21.947413177   192.168.56.21         192.168.56.51         TCP      85     6789 → 47221 [PSH, ACK] Seq=1 Ack=27 Win=28960 Len=17 TSval=958673 TSecr=952013 [TCP segment of a reassembled PDU]

Frame 15137: 85 bytes on wire (680 bits), 85 bytes captured (680 bits) on interface 0
Linux cooked capture
Internet Protocol Version 4, Src: 192.168.56.21, Dst: 192.168.56.51
Transmission Control Protocol, Src Port: 6789, Dst Port: 47221, Seq: 1, Ack: 27, Len: 17
_______________________________________________________
							
	The WebServer sends a HTTP Header to the Client	
_______________________________________________________

No.     Time           Source                Destination           Protocol Length Info
  15138 21.947428388   192.168.56.51         192.168.56.21         TCP      68     47221 → 6789 [ACK] Seq=27 Ack=18 Win=29216 Len=0 TSval=952013 TSecr=958673

Frame 15138: 68 bytes on wire (544 bits), 68 bytes captured (544 bits) on interface 0
Linux cooked capture
Internet Protocol Version 4, Src: 192.168.56.51, Dst: 192.168.56.21
Transmission Control Protocol, Src Port: 47221, Dst Port: 6789, Seq: 27, Ack: 18, Len: 0
_______________________________________________________________________________________________________
												
	The Client acknowledgments of HTTP Header by sending the Delivery Receipt to the WebServer	
_______________________________________________________________________________________________________

No.     Time           Source                Destination           Protocol Length Info
  15141 21.951466519   192.168.56.21         192.168.56.51         TCP      69     6789 → 47221 [PSH, ACK] Seq=18 Ack=27 Win=28960 Len=1 TSval=958674 TSecr=952013 [TCP segment of a reassembled PDU]

Frame 15141: 69 bytes on wire (552 bits), 69 bytes captured (552 bits) on interface 0
Linux cooked capture
Internet Protocol Version 4, Src: 192.168.56.21, Dst: 192.168.56.51
Transmission Control Protocol, Src Port: 6789, Dst Port: 47221, Seq: 18, Ack: 27, Len: 1
_______________________________________________________________________
									
	The WebServer sends a HTTP Response excerpt to the Client	
_______________________________________________________________________

No.     Time           Source                Destination           Protocol Length Info
  15142 21.951487676   192.168.56.51         192.168.56.21         TCP      68     47221 → 6789 [ACK] Seq=27 Ack=19 Win=29216 Len=0 TSval=952014 TSecr=958674

Frame 15142: 68 bytes on wire (544 bits), 68 bytes captured (544 bits) on interface 0
Linux cooked capture
Internet Protocol Version 4, Src: 192.168.56.51, Dst: 192.168.56.21
Transmission Control Protocol, Src Port: 47221, Dst Port: 6789, Seq: 27, Ack: 19, Len: 0
_______________________________________________________________________________________________________________
														
	The Client acknowledgments of HTTP Response excerpt by sending the Delivery Receipt to the WebServer	
_______________________________________________________________________________________________________________

No.     Time           Source                Destination           Protocol Length Info
  15144 21.951927889   192.168.56.21         192.168.56.51         HTTP     125    HTTP/1.1 200 OK 

Frame 15144: 125 bytes on wire (1000 bits), 125 bytes captured (1000 bits) on interface 0
Linux cooked capture
Internet Protocol Version 4, Src: 192.168.56.21, Dst: 192.168.56.51
Transmission Control Protocol, Src Port: 6789, Dst Port: 47221, Seq: 19, Ack: 27, Len: 57
[3 Reassembled TCP Segments (75 bytes): #15137(17), #15141(1), #15144(57)]
Hypertext Transfer Protocol
_______________________________________________________________________
									
	The WebServer sends a HTTP Response excerpt to the Client	
_______________________________________________________________________

No.     Time           Source                Destination           Protocol Length Info
  15145 21.951940500   192.168.56.51         192.168.56.21         TCP      68     47221 → 6789 [ACK] Seq=27 Ack=76 Win=29216 Len=0 TSval=952014 TSecr=958674

Frame 15145: 68 bytes on wire (544 bits), 68 bytes captured (544 bits) on interface 0
Linux cooked capture
Internet Protocol Version 4, Src: 192.168.56.51, Dst: 192.168.56.21
Transmission Control Protocol, Src Port: 47221, Dst Port: 6789, Seq: 27, Ack: 76, Len: 0
_______________________________________________________________________________________________________________
														
	The Client acknowledgments of HTTP Response excerpt by sending the Delivery Receipt to the WebServer	
_______________________________________________________________________________________________________________

No.     Time           Source                Destination           Protocol Length Info
  15147 21.952441884   192.168.56.21         192.168.56.51         TCP      146    6789 → 47221 [PSH, ACK] Seq=76 Ack=27 Win=28960 Len=78 TSval=958674 TSecr=952014

Frame 15147: 146 bytes on wire (1168 bits), 146 bytes captured (1168 bits) on interface 0
Linux cooked capture
Internet Protocol Version 4, Src: 192.168.56.21, Dst: 192.168.56.51
Transmission Control Protocol, Src Port: 6789, Dst Port: 47221, Seq: 76, Ack: 27, Len: 78
_______________________________________________________________________
									
	The WebServer sends a HTTP Response excerpt to the Client	
_______________________________________________________________________

No.     Time           Source                Destination           Protocol Length Info
  15148 21.952456767   192.168.56.51         192.168.56.21         TCP      68     47221 → 6789 [ACK] Seq=27 Ack=154 Win=29216 Len=0 TSval=952014 TSecr=958674

Frame 15148: 68 bytes on wire (544 bits), 68 bytes captured (544 bits) on interface 0
Linux cooked capture
Internet Protocol Version 4, Src: 192.168.56.51, Dst: 192.168.56.21
Transmission Control Protocol, Src Port: 47221, Dst Port: 6789, Seq: 27, Ack: 154, Len: 0
_______________________________________________________________________________________________________________
														
	The Client acknowledgments of HTTP Response excerpt by sending the Delivery Receipt to the WebServer	
_______________________________________________________________________________________________________________

No.     Time           Source                Destination           Protocol Length Info
  15150 21.952938475   192.168.56.21         192.168.56.51         TCP      173    6789 → 47221 [PSH, ACK] Seq=154 Ack=27 Win=28960 Len=105 TSval=958674 TSecr=952014

Frame 15150: 173 bytes on wire (1384 bits), 173 bytes captured (1384 bits) on interface 0
Linux cooked capture
Internet Protocol Version 4, Src: 192.168.56.21, Dst: 192.168.56.51
Transmission Control Protocol, Src Port: 6789, Dst Port: 47221, Seq: 154, Ack: 27, Len: 105
_______________________________________________________________________
									
	The WebServer sends a HTTP Response excerpt to the Client	
_______________________________________________________________________

No.     Time           Source                Destination           Protocol Length Info
  15151 21.952952968   192.168.56.51         192.168.56.21         TCP      68     47221 → 6789 [ACK] Seq=27 Ack=259 Win=29216 Len=0 TSval=952014 TSecr=958674

Frame 15151: 68 bytes on wire (544 bits), 68 bytes captured (544 bits) on interface 0
Linux cooked capture
Internet Protocol Version 4, Src: 192.168.56.51, Dst: 192.168.56.21
Transmission Control Protocol, Src Port: 47221, Dst Port: 6789, Seq: 27, Ack: 259, Len: 0
_______________________________________________________________________________________________________________
														
	The Client acknowledgments of HTTP Response excerpt by sending the Delivery Receipt to the WebServer	
_______________________________________________________________________________________________________________

No.     Time           Source                Destination           Protocol Length Info
  15153 21.953394673   192.168.56.21         192.168.56.51         TCP      148    6789 → 47221 [PSH, ACK] Seq=259 Ack=27 Win=28960 Len=80 TSval=958674 TSecr=952014

Frame 15153: 148 bytes on wire (1184 bits), 148 bytes captured (1184 bits) on interface 0
Linux cooked capture
Internet Protocol Version 4, Src: 192.168.56.21, Dst: 192.168.56.51
Transmission Control Protocol, Src Port: 6789, Dst Port: 47221, Seq: 259, Ack: 27, Len: 80
_______________________________________________________________________
									
	The WebServer sends a HTTP Response excerpt to the Client	
_______________________________________________________________________

No.     Time           Source                Destination           Protocol Length Info
  15154 21.953408721   192.168.56.51         192.168.56.21         TCP      68     47221 → 6789 [ACK] Seq=27 Ack=339 Win=29216 Len=0 TSval=952015 TSecr=958674

Frame 15154: 68 bytes on wire (544 bits), 68 bytes captured (544 bits) on interface 0
Linux cooked capture
Internet Protocol Version 4, Src: 192.168.56.51, Dst: 192.168.56.21
Transmission Control Protocol, Src Port: 47221, Dst Port: 6789, Seq: 27, Ack: 339, Len: 0
_______________________________________________________________________________________________________________
														
	The Client acknowledgments of HTTP Response excerpt by sending the Delivery Receipt to the WebServer	
_______________________________________________________________________________________________________________

No.     Time           Source                Destination           Protocol Length Info
  15156 21.953900415   192.168.56.21         192.168.56.51         TCP      169    6789 → 47221 [PSH, ACK] Seq=339 Ack=27 Win=28960 Len=101 TSval=958675 TSecr=952015

Frame 15156: 169 bytes on wire (1352 bits), 169 bytes captured (1352 bits) on interface 0
Linux cooked capture
Internet Protocol Version 4, Src: 192.168.56.21, Dst: 192.168.56.51
Transmission Control Protocol, Src Port: 6789, Dst Port: 47221, Seq: 339, Ack: 27, Len: 101
_______________________________________________________________________
									
	The WebServer sends a HTTP Response excerpt to the Client	
_______________________________________________________________________

No.     Time           Source                Destination           Protocol Length Info
  15157 21.953914290   192.168.56.51         192.168.56.21         TCP      68     47221 → 6789 [ACK] Seq=27 Ack=440 Win=29216 Len=0 TSval=952015 TSecr=958675

Frame 15157: 68 bytes on wire (544 bits), 68 bytes captured (544 bits) on interface 0
Linux cooked capture
Internet Protocol Version 4, Src: 192.168.56.51, Dst: 192.168.56.21
Transmission Control Protocol, Src Port: 47221, Dst Port: 6789, Seq: 27, Ack: 440, Len: 0
_______________________________________________________________________________________________________________
														
	The Client acknowledgments of HTTP Response excerpt by sending the Delivery Receipt to the WebServer	
_______________________________________________________________________________________________________________

No.     Time           Source                Destination           Protocol Length Info
  15160 21.954542165   192.168.56.21         192.168.56.51         TCP      68     6789 → 47221 [FIN, ACK] Seq=440 Ack=27 Win=28960 Len=0 TSval=958675 TSecr=952015

Frame 15160: 68 bytes on wire (544 bits), 68 bytes captured (544 bits) on interface 0
Linux cooked capture
Internet Protocol Version 4, Src: 192.168.56.21, Dst: 192.168.56.51
Transmission Control Protocol, Src Port: 6789, Dst Port: 47221, Seq: 440, Ack: 27, Len: 0
_______________________________________________________________________________
										
	The WebServer acknowledgments and closes the Client's connection	
_______________________________________________________________________________

No.     Time           Source                Destination           Protocol Length Info
  15162 21.954744862   192.168.56.51         192.168.56.21         TCP      68     47221 → 6789 [FIN, ACK] Seq=27 Ack=441 Win=29216 Len=0 TSval=952015 TSecr=958675

Frame 15162: 68 bytes on wire (544 bits), 68 bytes captured (544 bits) on interface 0
Linux cooked capture
Internet Protocol Version 4, Src: 192.168.56.51, Dst: 192.168.56.21
Transmission Control Protocol, Src Port: 47221, Dst Port: 6789, Seq: 27, Ack: 441, Len: 0
_______________________________________________________________________________
										
	The Client acknowledgments and closes the WebServer's connection	
_______________________________________________________________________________

No.     Time           Source                Destination           Protocol Length Info
  15163 21.955085965   192.168.56.21         192.168.56.51         TCP      68     6789 → 47221 [ACK] Seq=441 Ack=28 Win=28960 Len=0 TSval=958675 TSecr=952015

Frame 15163: 68 bytes on wire (544 bits), 68 bytes captured (544 bits) on interface 0
Linux cooked capture
Internet Protocol Version 4, Src: 192.168.56.21, Dst: 192.168.56.51
Transmission Control Protocol, Src Port: 6789, Dst Port: 47221, Seq: 441, Ack: 28, Len: 0
_______________________________________________________________________________________
											
	The WebServer acknowledgments the connection termination with the Client	
_______________________________________________________________________________________

